{
  "title": "Clinical Decision Framework",
  "tabs": "[{\"label\":\"Assessment\",\"icon\":\"\ud83e\ude7a\",\"heading\":\"Clinical Assessment\",\"body\":\"Systematic review of presenting symptoms, vital signs, and patient history. Prioritise by acuity. Document findings using SBAR format: Situation, Background, Assessment, Recommendation. Do not proceed to diagnosis without completing assessment.\"},{\"label\":\"Diagnosis\",\"icon\":\"\ud83d\udd2c\",\"heading\":\"Differential Diagnosis\",\"body\":\"Generate a ranked list of probable diagnoses based on assessment data. Apply Occam's razor \u2014 the simplest explanation consistent with all findings takes precedence. Document and rule out red-flag conditions first.\"},{\"label\":\"Treatment\",\"icon\":\"\ud83d\udc8a\",\"heading\":\"Treatment Planning\",\"body\":\"Select evidence-based interventions matched to confirmed diagnosis. Consider contraindications, patient preferences, and resource availability. Document decision rationale and obtain informed consent before proceeding.\"},{\"label\":\"Follow-up\",\"icon\":\"\ud83d\udccb\",\"heading\":\"Follow-up Protocol\",\"body\":\"Define clear follow-up criteria: timeframe, responsible clinician, escalation triggers. Patient education must include what to monitor and when to seek urgent review. Close the loop on all outstanding investigations.\"}]",
  "primaryColor": "#285f9f",
  "bgColor": "#f5f2ea",
  "basePlateImage": "v2-base-blue.png",
  "durationPerTab": 5,
  "activeTab": 0
}